filename,summary
dd19e6d3-466d-4806-bb12-5cffaa37b0ea.pdf,"The City of Chicago is addressing affordable housing shortages by issuing multi-family housing revenue bonds to finance the acquisition, construction, and equipping of affordable and market rate residential units at 208 S. LaSalle Street. The project, approved by the City Council, will be financed through the sale of Bonds, incremental taxes, and will not constitute an indebtedness of the City or State. The Bonds, not exceeding $25 million, will have a maximum interest rate of 7.5% and mature within seven years. The Authorized Officer is authorized to execute necessary agreements and documents, and the proceeds will be used as outlined in the Bond Indenture. The Developer is designated for the Project and public approval is required for issuing the Bonds. The City Council can pay up to $26,000,000 from Incremental Taxes to finance the Project. The ordinance is effective immediately."
921f58bc-65c6-40c1-b5fd-855b7d639fd8.pdf,"The City of Chicago is issuing multi-family housing revenue bonds to finance affordable housing for low- and moderate-income families. The project, located at 111 W. Monroe Street, will be financed through tax increment financing and will involve multiple entities. The City Council has authorized the issuance of Bonds up to $40 million, with a maturity of no later than seven years. The Bonds are limited obligations of the City, payable from specified revenues and funds, and will be sold to an Underwriter. The ordinance authorizes fees and expenses related to Bonds, including an Issuer Fee, Legal Reserve Fee, and Administrative Fee. It also authorizes a Redevelopment Agreement for payment of Redevelopment Project Costs using TIF funds. The ordinance is effective immediately upon approval."
49c4abe0-46bf-4fe6-b443-77ec99ea0fa0.pdf,"Chicago's ordinance, effective 60 days after passage, amends Section 4-4-331 to prohibit sales of unregulated cannabinoid hemp products by licensees in the central business district, Near North Side Area, and Midway Residential Area. Violations, considered separate and distinct offenses, result in $2,000.00 to $5,000.00 fines and potential license suspension or revocation."
1a8484ba-6fe0-4cfd-884d-ed76738e4474.pdf,"Chicago's City Council ordinance revises the Municipal Code, setting $100.00 fines for certain traffic violations and updating the Clear Path Relief Program. The program now includes 'categorically eligible' and 'eligible participants', both with income limits, and authorizes the Administrator to establish rules. Section 9-101-020 is also amended, altering automated speed enforcement system regulations and reducing the citation issuance period for new installations to 30 days. The ordinance takes effect upon passage and publication, as stated by Alderman of the 21st Ward."
2e30962d-9ec3-4dfb-8910-0ae408d56523.pdf,"Chicago's City Council, led by 35th Ward Alderman Carlos Ramirez-Rosa, has amended the Zoning Ordinance, designating North Milwaukee Avenue and other streets as Pedestrian Streets. The ordinance, indicated on Map No. 7-J, affects the area bounded by North Gresham Avenue, North Drake Avenue, and North Central Park Avenue, and modifies sections 17-3-0500 and 17-3-0503-D. It is in full force upon due passage and publication, impacting the common address 2931-57 & 2912-34 North Milwaukee Avenue."
5984e9c6-d852-4c65-8bd5-7264553d4653.pdf,"Chicago's ordinance regulates sales and advertising of cannabis and substances like kratom, following the legalization of cannabis and industrial hemp. Unregulated stores lack the restrictions of regulated medical cannabis dispensing organizations and cannabis business establishments under the Cannabis Tax and Regulation Act. The ordinance introduces rules for cannabinoid retailer signage and mandates a public education campaign by the Department of Business Affairs and Consumer Protection and the Department of Public Health."
7e0a4a75-871a-4b7f-9cdb-163ba71d9ba4.pdf,"Chicago's Pedestrian and Traffic Safety Committee's resolution addresses the city's 7,420 miles of sidewalks, the Shared Cost Sidewalk Program with 2,253 applications in 2025, repair costs of $600 to $1,500, 10,437 Sidewalk Inspection requests, and $1 million in law settlements. It also mentions the Inspector General's advisory on service delivery, the shift to grid-based services, and the success of tree trimming."
85233096-2e16-44f4-bd3b-91aebed8e158.pdf,"Chicago's City Council, including Alderman Ronnie Mosley, proposes an ordinance amending Section 17-6-0400 and 17-6-0403-F Use Table and Standards of the Chicago Zoning Ordinance, affecting the PMD (Planned Manufacturing District). The specifics of the language changes, effective upon approval, are not detailed."
033b0b31-b124-4a5c-8947-c73c2f544052.pdf,"The Mayor of Chicago appoints members to the Chicago Housing Authority's Board of Commissioners, the Community College District No. 508's board, the Chicago Parks District's Board of Commissioners, and the Chicago Transit Authority's board. The Transit Authority, established in 1945, allows the Mayor to appoint 4 members, who then appoint an Executive Director. All appointments require City Council's advice and consent."
fa9ef82e-e396-49b9-996f-0f6402f9ec56.pdf,"Trump's funding freeze has hit Chicago's MBEs and WBEs hard. ComEd, seeking franchise renewal and recently granted a $606 million rate increase, primarily employs multinational corporations. The resolution demands ComEd and Doug Scott, Chairman of the Illinois Commerce Commission, to present detailed MBE and WBE usage reports for 2022, 2023 and 2024 to the Chicago City Council's Committee on Budget and Government Operations before any agreement renewal."
9a8d8b47-fcde-4b86-b379-f5b4531bf44e.pdf,"The resolution highlights the role of municipal bonds in infrastructure projects, used by 50,000+ U.S. governments. Investors receive tax benefits, reducing borrowing costs. Illinois' $137.4 billion investment since 2015 has saved taxpayers $2.9 billion. Eliminating the tax-exempt status would increase costs, affecting public investment. The Chicago City Council urges the U.S. Congress to preserve the tax-exempt status of municipal bonds."
