filename,summary
99e922e2-6442-4b39-8aee-85edfdc4d143.pdf,"The ordinance authorizes the City of Chicago to collaborate with CMAP to analyze the economic impacts of transportation improvements, with the city providing a financial contribution not exceeding $9,000."
b9739307-c917-4e78-b693-418334fdf3ce.pdf,"The legislation authorizes the sale of a City-owned property at 5349 S. Wabash Street in Chicago, Illinois to The Black Fire Brigade Org for adaptive reuse as an EMS and firefighting instruction center for youth."
06ad2ea8-6f8a-49f9-9ba3-0dab73d4f608.pdf,The legislation ensures uninterrupted provision of essential health and social services by private providers contracted by the Chicago Department of Public Health and Department of Family and Support Services.
a07fc4b7-ff5e-412c-8522-76aa538a2319.pdf,This ordinance amends the Municipal Code of Chicago to restrict the issuance of new licenses for the sale of alcoholic liquor and package goods within specific areas of the city.
c1ded101-ef82-426d-b554-81ce6000bd1e.pdf,"This Chicago City Council ordinance aims to address over-concentration of businesses selling alcohol in specific areas, amending licensing regulations on Archer Avenue to mitigate negative effects."
a421f216-dea7-46ac-9a8a-57fd183c7fd1.pdf,"This legislation establishes a joint order escrow agreement between K Town BCP, LLC (Developer), City of Chicago, and Escrowee for reimbursing Developer for Remediation Work costs under a specified process."
ef4983d5-de90-43c5-8f18-3f3f61832441.pdf,"Chicago's ""Peace for All"" resolution calls for US intervention to achieve lasting peace in the Middle East by facilitating de-escalation and humanitarian aid, with copies sent to relevant federal officials."
0b096a69-a492-4236-825d-a48dcdfb2d06.pdf,"This legislation requires disclosure of ownership interests related to a Right of Entry agreement for access to Chicago city property, with specific details about the submitting party and the nature of ownership."
ade405e0-1810-4d81-86b9-9221cba99dfc.pdf,"The legislation appears to detail the scope drawings related to a project, potentially encompassing various aspects such as design, dimensions, and specifications within 41 pages."
330c6b3d-9f18-43a4-ae8a-280299da524c.pdf,"This legislation addresses various issues related to public safety and security, including criminal offenses, penalties, and activities to promote law enforcement and community safety."
5c55219c-9e3d-4978-8221-27163d8f35bc.pdf,"The legislation outlines the legal description of a parcel known as 4700, spanning 40 units."
76483223-5e3c-4491-913a-c2f5c7fef38f.pdf,"This legislation pertains to the sale of a property in Chicago, Illinois, between Sophia Green and the listed address. The appraised value is $7,100 with a bid amount of $1,000."
d73f9261-7d5f-445c-8151-999e8fe457ec.pdf,This ordinance amends the Municipal Code of the City of Chicago to define and regulate the issuance of consumption on premises - incidental activity licenses for various businesses selling alcoholic beverages.
bf9743e7-fd76-4228-b958-7a4be7907ba5.pdf,The legislation involves an intergovernmental agreement between the City of Chicago and the Board of Education to allocate tax increment financing funds for soccer field improvements at Percy L. Julian High School.
851c2397-2aa4-4f21-909a-5fc4a997eb76.pdf,The legislation involves an ordinance for an intergovernmental agreement between the City of Chicago and the Chicago Park District to expand Ronan Park using Tax Increment Financing (TIF) funds.
12c600f8-fa01-4386-abbe-df6370e66c51.pdf,"This legislation involves multiple City Council members sponsoring a matter, tracked by the Office of City Clerk in Chicago. The document outlines meeting details and contact information for further inquiries."
94a55f38-368a-4976-afc5-aa456b57f054.pdf,This legislation involves an ordinance requesting approval for a Class L tax incentive for a property at 500 N LaSalle Drive in Chicago to promote preservation and rehabilitation of historically significant buildings.
7860eff4-f20f-4681-86a4-c04d84400e83.pdf,"The Mayor of Chicago is requesting the City Council to consider ordinances for the negotiated sale of a city-owned property at 4441 S. Ellis Ave. for $25,000 to Greg and Nina Davis for a single-family home construction project."
9798652f-f5e0-42e8-aa7c-71b0a3db4ed8.pdf,"This legislation recommends amending the Municipal Code of Chicago to disallow additional Package goods licenses on a portion of Devon Avenue, as proposed by Alderman Maria E. Hadden."
3b33aded-053e-45a6-9fc5-4972310d1813.pdf,City of Chicago ordinance supporting property tax incentives for industrial property owners within Cook County. Specifically mentions MICO Express LCC receiving tax relief for environmental remediation and construction on designated property.
3ea2c761-adaa-462f-a486-f33e1842b850.pdf,An ordinance authorizes amending a license agreement with Chicago Concourse Development Group for wireless communication access system and services at Chicago O'Hare and Chicago Midway International Airports.
63f00483-626d-47b4-b69c-595c3486fad8.pdf,The Committee on Finance recommends the ownership transfer agreement to East Lake Darul LLC for Darul Amaan Senior Apartments located in Chicago's 33rd Ward at 4814-4820 N. Kedzie Ave.
1110001f-0110-4f51-b576-4c887a746c71.pdf,The legislation involves amending the Lincoln Avenue Redevelopment Project Area Plan in the City of Chicago to align with the revised dates for project completion and financing retirement according to state law.
63537dcf-0133-47f0-97b3-98f3ea4613ae.pdf,"This legislation outlines a new commercial development in Chicago, covering a 37,750 SF site with a total building area of 9,600 SF. Proposed design includes a fast-food restaurant and parking."
9fc0cd79-14fc-4343-82fa-cd53b024f6ae.pdf,Amendment to Chicago's Municipal Code granting certain employees of the Department of Streets and Sanitation police powers to enforce various construction-related ordinance violations within the city.
25d62a1e-1f98-4252-a5cd-3324bd8857f6.pdf,This legislation specifies that funds in an Escrow Account are to be used for reimbursing a Developer for specific environmental costs related to Remediation Work at a City Property.
2f1b71fb-1ebf-4787-8f60-5c7b08f656fd.pdf,"City of Chicago Economic Disclosure Statement and Affidavit legislation requires disclosing party to provide information about themselves, contract details, ownership interests, income to officials, and subcontractors involved in the transaction or undertaking."
ec65a4bc-d7cf-4490-ae48-f255acf2d9d2.pdf,"This ordinance amends the Municipal Code of Chicago to regulate structures on the public way, including kiosks and public bookcases, requiring a public way use permit and outlining associated fees."
8edada39-89da-4748-9ea0-fa86ba1c8e91.pdf,"This legislation proposes an ordinance to designate precincts in the 13th Ward as Restricted Residential Zones, prohibiting additional shared housing and vacation rentals in these areas."
595802ea-8606-46fb-9021-5ed3fa91be50.pdf,"The legislation depicts the CTA Terminal and Vacant MWRD property previously sold by the U.S. Marine Corps, and Northside College Prep High School sold by MWRD."
b2fe0b94-e584-45f8-827c-8216a306861d.pdf,An ordinance presented to the City Council of Chicago by Mayor Brandon Johnson proposes the acquisition of a property on S. Halsted St for an envisioned migrant shelter operation.
61645eca-227f-4b99-95ca-fd13ad7431f1.pdf,"The ordinance amends the Municipal Code of Chicago to restrict the issuance of additional licenses for the sale of alcoholic liquor within certain areas, with the changes effective upon approval."
f1336a4f-404b-47a3-8ff6-fed254e508a3.pdf,"The legislation is a Land Use Restriction Agreement between the City of Chicago and New City Redevelopment Limited Partnership, outlining various restrictions and terms related to the project, occupancy, rental, and transfer."
c4e4ef6f-79b9-472c-aebd-57da66903d61.pdf,"This legislation outlines project budgets for acquisition costs, hard costs, soft costs, and MBE/WBE budgets for a total project amount of $17,410,467 with specific allocations for minority and women-owned businesses."
873bc283-c371-48a8-b689-66b525a92717.pdf,"This ordinance amends the Municipal Code of Chicago by defining hate crimes and incidents, including non-criminal acts motivated by bias and requiring the Chicago Police Department to report relevant information regularly."
43e9e0df-561d-4063-8ac2-4b8d9f3deac5.pdf,"An ordinance authorizing the negotiated sale of City-owned vacant properties to SSNS Construction, Inc. for commercial development, including car wash, gas station, parking, restaurant, and retail space in Chicago."
49f07471-4235-46f3-99ee-634a45ab6b01.pdf,"This ordinance establishes the Chicago Administrative Procedure Ordinance to set standards for City department rulemaking, ensuring transparency, public participation, clarity, and accessibility of rules governing residents and businesses."
ba0b2157-8bc7-402c-90e1-e187496a848e.docx,The legislation authorizes the sale of City-owned properties under the Adjacent Neighbors Land Acquisition Program to address parcels of real property with minimal value and costly maintenance.
2089a715-abb1-4752-88a3-05049ca4ff44.pdf,"This ordinance aims to amend the Municipal Code of Chicago to permit the issuance of more package goods licenses on a section of North Avenue, recommended by the Committee on License and Consumer Protection."
55722a61-b521-4c8c-b07e-6e0699860c3e.pdf,This legislation amends the Municipal Code of Chicago to allow additional package goods licenses on specific portions of State Street for one year. It specifies the affected areas and the timeline for enforcement.
6820c5c4-66de-4d79-961d-b1cdfe2174a5.docx,"Chicago City Council authorizes collaboration with the Chicago Metropolitan Agency for Planning to analyze economic impacts of transportation improvements, appropriating $9,000 for the study through an intergovernmental agreement."
5e12cac6-3b76-4db6-856f-6647662691f8.docx,"The ordinance addresses the City of Chicago's acquisition of real property, establishing programs for the disposition of certain vacant properties to generate revenue and mitigate cleanup and maintenance costs."
eaf23df6-58dd-4497-9477-60d20a04f220.pdf,The legislation establishes a digital signage network in Chicago for timely communication of city and other government information to enhance public safety and welfare through intergovernmental cooperation and efficiency.
25dcdd1d-a4a9-4553-b4b7-6ce93fb07e4e.pdf,The legislation introduces ordinances for minor amendments to the Greater Southwest Industrial East and Lincoln Avenue TIF districts under the Tax Increment Allocation Redevelopment Act in Chicago.
bc165872-76a9-4269-bfbb-a76665c29f95.pdf,"The resolution calls for a hearing on a proposed $402 million rate hike by Peoples Gas Company in Chicago, citing concerns about affordability, aggressive spending, profit levels, fixed monthly charges, and disproportionate disconnections in certain neighborhoods."
dae8b95e-3c08-4070-81ae-1b3d4a24caa0.pdf,This ordinance amends the Chicago Zoning Ordinance by removing certain segments of North Milwaukee Avenue from the Pedestrian Street designation. It lists the specific street segments affected.
aa9543f7-3242-43ff-8bd6-09a3a0c7ad55.pdf,This ordinance amends the Municipal Code of Chicago to include additional powers and duties for the Commissioner and Department related to various ordinances administered or enforced by the Department's Office of Labor Standards.
26210a84-9ad2-468a-8e19-311099591351.pdf,Legislation seeks approval to amend prior ordinance for City of Chicago to secure a $350M WIFIA loan from USEPA. Signed by Commissioner Andrea R. H. Cheng.
d0520c48-deba-4cc9-835e-cee439cafee5.pdf,The legislation authorizes the ownership transfer agreement for Darul Amaan Senior Apartments to East Lake Darul LLC. It aims to address the shortage of affordable housing in Chicago.
d2ca50d6-51ed-4878-94ae-e802c70f31de.pdf,This ordinance requests the renewal of an intergovernmental lease agreement between the City of Chicago and the University of Illinois for medical and administrative space at the Uptown Neighborhood Health Clinic.
fa7deae0-afce-4b56-b83d-d5c5537865bd.pdf,"The legislation contains various provisions involving financial transactions, business operations, regulatory compliance, and code enforcement. It includes sections related to taxes, payments, and government agency oversight."
94a6928c-435a-427d-9974-259f2bb68ca9.pdf,"This ordinance amends the Municipal Code of Chicago to include regulations for Cannabis Business Establishments in various zoning districts, specifying use categories and standards for different types of cannabis businesses."
f8eb43ec-1b7a-41d3-9613-c00149fe193f.pdf,The legislation authorizes the sale of a vacant City-owned property at 5009 Wabash Ave to Shelton Edwards under the Adjacent Neighbors Land Acquisition Program in Chicago.
d9c62447-5936-4fe0-8900-8a679a3cbfab.pdf,"This legislation requires entities seeking contracts with the City of Chicago to submit an Economic Disclosure Statement and Affidavit, disclosing ownership interests and general information related to the contract."
3587eff2-5056-4069-8f2e-872f4623f17d.pdf,"The ordinance amends Section 17-5-0207 of the Municipal Code in Chicago concerning Outdoor Patio dining, specifying regulations for outdoor patios for eating and drinking establishments in different zoning districts."
acf458de-47a0-40fd-9672-696b586274aa.pdf,"This ordinance amends the Chicago Zoning Ordinance to add an optional Administrative Adjustment and Variation for Type I applications, aiming to streamline the approval process for certain relief measures."
4653baf0-93f8-4ec6-b209-caac367002bc.pdf,"The legislation is an ordinance for a time extension to inspect City property at 1325 W 119th St by certain developers, assigned to the Committee on Housing and Real Estate."
6d1c539a-196e-4e8c-a936-011d6613ac47.pdf,"This legislation provides a detailed legal description of a property located at 3340 North Kedzie Avenue in Chicago, Illinois, including specific measurements and boundaries for the subject property."
aeedb50e-d721-46ab-a30f-69a42f4670f9.pdf,"Resolution supports the Affordable Connectivity Program providing internet access to underserved communities. Urges Congress for continued funding to ensure low-income households have vital internet access for work, education, and healthcare."
3841acb0-3283-4cc3-aa57-86bdbba31318.pdf,The ordinance allows the City of Chicago to utilize tax increment financing for the Edgewater/Ashland Redevelopment Project Area and covers the allocation of funds towards redevelopment project costs and obligations.
c10c8470-fad1-4b06-8550-53012ead625a.pdf,"This legislation authorizes a loan of up to $12,725,000 for the acquisition and rehabilitation of low- and moderate-income housing units in Illinois. Additional financing includes a senior permanent loan and low-income housing tax credit proceeds."
7d8d4b39-1ddb-49f9-ba9a-3855e9d02cc4.pdf,"The Chicago Economic Disclosure Statement and Affidavit requires disclosing party information, ownership interests, and details related to contracts with the city's Department of Procurement Services."
99c83803-d3c2-4b51-b2b1-87309a347231.docx,The Chicago Mayor transmits an ordinance to City Council to authorize an intergovernmental agreement with the Board of Education to allocate TIF funds for improvements at Kenwood Academy High School.
9ff5bcac-4b68-474b-868e-379c6336366f.pdf,"The legislation outlines a Collective Bargaining Agreement between Illinois Nurses Association and the City of Chicago effective from July 1, 2022, to June 30, 2027, including base salary increases and additional benefits."
2b016889-27c0-4428-8f8b-f3cdee2277f5.pdf,The legislation recommends issuing City of Chicago's Second Lien Wastewater Transmission Revenue Bonds Series 2024. The Committee on Finance suggests the City Council pass the proposed substitute ordinance.
35588363-4036-43ea-bed3-0a2f6fdd701f.pdf,This legislation is an intergovernmental agreement for professional services between the City of Chicago and the Chicago Housing Authority to provide housing modifications for low-income families with disabilities.
644007b9-dbfc-4d45-964f-ab504e6d8e83.pdf,This substitute ordinance in the City of Chicago aims to ensure uninterrupted provision of essential health and social services to residents by private service providers contracted by the city’s health and family services departments.
dad602c8-c38d-4b03-a2e2-d43d99ab58c0.pdf,"This ordinance outlines the establishment and modification of restricted residential zones in Chicago, specifically detailing the precincts and procedures involved in creating and renewing such zones."
9f48ae47-f661-412e-ac67-91091f1a43b4.pdf,"This ordinance amends the Municipal Code of Chicago by restricting the issuance of package goods licenses in certain areas, with the changes becoming effective upon passage and publication."
ba98785c-fe31-48d6-b734-39a50f19e4bc.pdf,"The legislation pertains to the legal description of city land in Cook County, Illinois, consisting of Lots 130 and 131 in A.C. Cummings & Co.'s subdivision with corresponding addresses and PINs."
3e848c48-e3ec-471c-8256-f3a7399c7bf6.pdf,"Legislation details the sale of three different city lots in Chicago to specific buyers at reduced purchase prices, intended for open space usage like a community plaza or museum garden."
d53c4fd2-f1d1-4485-bfdf-c57a166eec49.pdf,"This legislation pertains to the Economic Disclosure Statement required by the City of Chicago. It involves a company disclosing their legal name, contact information, and nature of ownership interests."
0cdd3945-4b59-4f44-87f7-f09479355213.pdf,"This ordinance amends the Chicago Municipal Code to establish a reward program for individuals who provide information leading to a conviction or finding of liability for illegal dumping, with criteria outlined."
68cc56a1-8016-4c3b-9a71-d30916a1ba99.pdf,"This legislation outlines the collective bargaining agreement between the City of Chicago and the International Union of Operating Engineers, Local 150—Heavy Equipment covering various economic terms and base salary increases."
53cc3c11-8293-4ed6-b7f9-940ad61e0aaf.pdf,This legislation in Chicago amends tenant remedies and rental agreements related to the maintenance of dwelling units and participation in Utility Billing Relief (UBR) program by landlords and tenants.
dc1cbdb3-5d3a-40f9-bdf6-0e93ac7153ea.pdf,The legislation proposes an ordinance for the City of Chicago to enter an Intergovernmental Agreement with the Board of Education to provide Tax Increment Financing funds for developing sports facilities at various high schools.
25584a58-d8d6-4799-9b78-b5f32ed300fa.pdf,"Chicago City Council amended the Municipal Code's affordable housing requirements to expand low-income housing access, defining terms like ""transit-served location"" and ""veteran,"" emphasizing long-term affordability in specific census tracts."
f3f0349d-4903-4648-aa21-8fdce9aef04e.pdf,"The legislation seeks to amend five Tax Increment Financing (TIF) districts in the City of Chicago to extend their duration and increase their budgets, as requested by the Commissioner of Planning and Development."
0090f3f9-0e38-47ab-a149-27430f0869a4.pdf,"The ordinance amends the Municipal Code of Chicago to provide Covered Employees with a private cause of action if denied entitled benefits, allowing them to seek damages and attorney's fees."
d69b42c6-62f9-4795-933d-5d92687612ae.pdf,"The legislation is an ordinance for a Fund 925 Amendment to the 2023 Appropriations in the City of Chicago, benefitting the Department of Public Health and Department of Fire."
00761b71-b22f-4e02-86e1-be67f54bcbd1.pdf,"This legislation outlines timelines for acquiring property interests, advertising for bids, and commencing construction of a bridge and highway project by specific dates in 2024 and 2025."
ab218435-ebc0-4d34-b147-2b51dabc691b.pdf,This ordinance aims to address over-concentration of liquor-selling businesses in specific areas of Chicago by amending restrictions on issuing package goods licenses in designated locations within the city.
280cca9c-1dd6-4f15-830c-ba3caa69c6f1.pdf,The legislation proposes amending the Municipal Code of Chicago to allow for the issuance of additional package goods licenses on a specific portion of 63rd Street as recommended by the Committee.
69626dee-194d-44a0-a6b7-e4787a302e60.pdf,"The legislation involves amending the municipal code in Chicago to set standards for rooftop and grade outdoor dining, adding optional administrative adjustment and variation provisions, designating a historical landmark, and making various map amendments."
f1b673a2-bd62-45df-9ede-a6590ec82893.pdf,"The legislation aims to amend the Municipal Code in Chicago regarding the eligibility qualifications for a Right to Eviction Counsel, establishing a pilot program and rules for legal assistance in eviction cases."
8b2b770d-b17d-4148-aa13-c84074d7d03d.pdf,The legislation seeks to amend the Municipal Code of Chicago to exclude paper or plastic bags provided by shoe repair or shine businesses from the definition regarding Paper Carryout Bag regulations.
ad81e949-dccf-460f-ab85-f9a1330cf465.pdf,"The Chicago ordinance amends the Municipal Code to restrict booting of motor vehicles to certain wards listed, prohibiting operations outside those specified locations. Effective upon passage and publication."
c6f772ed-531e-433d-a55a-50210b9b4f9d.pdf,"This ordinance amends the Municipal Code of Chicago to restrict the issuance of additional liquor licenses for certain areas, specifically targeting portions of Chicago Avenue."
899b36eb-9dfc-464c-8dde-0e1200789d7e.pdf,"The legislation discusses an ordinance related to the leasing of office space in Chicago by the Department of Assets, Information and Services for various city departments, including Public Safety and Climate initiatives."
a3d5907b-e2ee-44cc-957f-125c06aa12a6.pdf,"This legislation in the City of Chicago requires economic disclosure statements related to contracts, indicating ownership interests, income to city officials, and disclosure of subcontractors and retained parties in transactions."
48d9b745-f47e-410e-a379-5014ea4a6f46.pdf,"This ordinance amends the Municipal Code of Chicago to allow limited neighborhood parking exemptions for certain commercial vehicles, requiring a special permit and an authorizing ordinance."
cdedc59d-f2ea-429c-96a0-f06ff7a3c44b.pdf,The ordinance authorizes the City of Chicago to enter a redevelopment agreement with Rebuild Foundation NFP for neighborhood opportunity funds supporting the St. Laurence Arts Incubator project.
9966d423-7966-4c14-8789-03ed24190c41.pdf,"This legislation provides a legal description of a specific property located in Cook County, Illinois, known as 2215-17 W. Warren Boulevard in Chicago, with a specific PIN number."
30c3585a-623d-47e7-b7b4-dfce96e8e4a3.pdf,"The City of Chicago 2024 Appropriations Ordinance outlines budget allocations for the fiscal year, specifying funds for various departments and agencies, detailing assets, revenues, expenses, and salary rates."
b0adf7e3-2436-42ab-9a8a-72e2370e3c85.pdf,"The legislation is a Redevelopment Agreement between the City of Chicago and Team Pioneros, LLC, allowing private development for public welfare under constitutional and statutory authority with specific City Council ordinances."
dae755a8-2ddd-4e4c-9666-1838b5489ba5.pdf,"The legislation proposes a budget of $5.6 million for a project at John T. McCutcheon Elementary School in Chicago, with $3.4 million requested from the Lawrence/Broadway TIF fund for repairs."
1a44bd9c-f022-4010-ab47-5a8675ccd417.pdf,"The legislation outlines a collective bargaining agreement between the City of Chicago and Mid-American Carpenters Regional Council - Inspectors from 2022 to 2027, including base salary increases and additional economic terms."
0674d5ab-a668-460c-b007-049ca157a75a.pdf,"This ordinance designates a specific area in Chicago as a Restricted Residential Zone, prohibiting new shared housing units and vacation rentals for four years in the specified boundary."
07c914b6-c3ad-4692-9474-4a5e25dc2283.pdf,"This legislation approves $750,000 for improvements at Bessemer Park in Chicago, funded by the Commercial Avenue TIF. Renovations include a baseball diamond, lighting, fencing, benches, and a water feature."
349af76d-bbe5-4afe-8a20-3dd3f1290a87.pdf,"This legislation remains unclear and does not provide any information, as Exhibit D has intentionally been omitted, leaving a gap in understanding the content."
e6732fe2-1de1-4ccf-a284-572d70ae5296.pdf,"Proposed 4-story mixed-use building with retail/commercial space on the ground floor and live/work condominium residences on upper floors, aligning with community development priorities and revitalization efforts."
13b05e9b-7461-45b2-ba9b-67ae9beac1c3.pdf,"The ordinance authorizes tax incentives in the form of property tax relief for industrial property owners in Chicago, aligning with the Cook County Tax Incentive Ordinance to support industrial development and encourage industry growth."
af60960a-8437-4120-86f9-d79abd0c2aa6.pdf,"The legislation authorizes the allocation of funds or bonds for the construction of permanent supportive housing on property donated by Lake View Lutheran Church, sponsored by Mayor Johnson."
431710c0-65ca-48b9-8bc0-65b3c69bd49b.pdf,"This legislation defines legal property descriptions for various parcels in Cook County, Illinois, detailing specific lot numbers and subdivisions within designated townships, ranges, and meridians."
