filename,summary
abc77fbe-0ef1-426f-9e35-a5ba4af5bc31.pdf,"Chicago's City Council proposes amending Section 11-4-1600, targeting violations of Section 7-28-390, 7-28-440, or 11-4-1500. Registered vehicle owners and operators will be jointly liable for violations, facing vehicle seizure, impoundment, a $1,000 penalty, and towing/storage fees. The City can seek injunctive relief in Cook County's Circuit Court. Violations may lead to business license suspension, revocation, or denial of applications. The ordinance is effective 10 days post-passage."
23fc6961-162d-472c-8d16-ca2c75b12cca.pdf,"Chicago's City Council has amended the Municipal Code, enabling the Commissioner to fine or revoke licenses for violations of Sections 7-28-390 and 7-28-440. Violating vehicles can be fined, seized, and impounded. The Department of Streets and Sanitation, Office of Emergency Management and Communications, and the Chicago Police Department will report and investigate violations. The ordinance takes effect 10 days post-publication."
37099e29-c3ba-477e-8070-969c60349d4e.pdf,"Chicago's City Council approved an ordinance, spearheaded by 37th Ward Alderman Emma Mitts, realigning a liquor moratorium area with ward boundaries, notably on North Avenue between Central and Luna Avenues. The ordinance revises Section 4-60-023 of the Municipal Code, eliminating restrictions on additional package goods licenses, but maintains requirements under Section 4-60-021(d) of the liquor moratorium ordinances. The ordinance is enforceable upon passage and publication."
a329108e-db1a-4cf7-b19e-4c0c28d09f1c.pdf,"Chicago's $9,500,000 loan to LeClaire Partners for the 4% Project at 4809 West 44th Street and 4442 South Cicero Avenue, falls under the Tax Increment Allocation Redevelopment Act in the Cicero/Stevenson Redevelopment Project Area. The Community Development Commission recommended the borrower as the developer, with project costs covered by a Redevelopment Agreement and funded by the TIF Fund."
2d6b239b-4c0b-47dc-9ed4-2a951e97fdfe.pdf,"The City of Chicago has approved a loan of up to $9.5 million to LeClaire Partners A-North JV LP for the development of affordable housing units, in response to a shortage of affordable rental housing. The project, which includes two buildings totaling 138 units, will be financed by the Department of Housing and the Chicago Housing Authority. The City Council also approved redevelopment plans and tax increment financing for several areas, with the Borrower designated as the developer. A Senior Loan for the construction period will be sourced from Bank of America or another approved lender, with other loans detailed from various sources. The General Partner Equity amount is $100 or as determined by the Authorized DOH Officer."
9214c188-7365-414d-b433-ebb8bf515e4b.pdf,"Chicago's City Council approves the $1 sale of its $201,212-valued, undevelopable land at 12100 S. Peoria Street to the Cook County Land Bank Authority, with a six-month closing period. The Commissioner of DPD and the City’s Corporation Counsel will oversee the transaction. The Authority will pay all closing costs, and a quitclaim deed will be executed. The ordinance's validity is confirmed, aiming to remove vacant property from the City's inventory."
5cf0e21f-e0e0-48ec-b753-e5480a3f1d54.pdf,"The ordinance, proposed by Alderman Andre Vasquez of the 40th Ward, will take effect 10 days after its passage and publication. It amends various sections of the Municipal Code of Chicago to enforce vehicle registration plates requirements, classifies violations as a civil offense punishable by a $250.00 fine, and authorizes the Police Department, the Department of Streets and Sanitation, and the Department of Aviation to enforce these regulations."
669f198f-154a-428c-9afc-8256ef027ad5.pdf,"Chicago's City Council revised Section 9-76-160 of the Municipal Code, impacting vehicle registration plates. Non-compliant vehicles, per the Illinois Vehicle Code, can't be parked, leading to fines (Section 9-100-020), specific covered vehicle requirements, a $500 penalty, towing/storage fees, possible vehicle seizure/impoundment, with police involvement, and the right to a vehicle impoundment hearing. The ordinance takes effect 10 days post-publication."
